<?xml version="1.0" encoding="UTF-8"?>
<applications xmlns:xsi="http://www.w3.org/2001/XMLSchema-instance"
	xsi:noNamespaceSchemaLocation="CertificateRequest.xsd">
	
	<application>
		
		<truststores>
								
			<truststoreonly>
				<trustprofilename>EPPKI_TP</trustprofilename>
				
				<truststore>
					<jkstruststore>
						<storealias>TestCA1</storealias >
						<storelocation>/tmp/TestTP.JKS</storelocation>
						<storepassword></storepassword>
					</jkstruststore>
				</truststore>
				
				<postscript>
                    <pathname>/tmp/testScript1.sh</pathname>
                    <parameter>
                         <name>file</name>
                         <value>testScript2</value>
                    </parameter>	
				</postscript>	
									
				<oncheckresult>
                     <actionlist>
                            <checkcause>trustUpdate</checkcause>
                            <action>RunScript</action>
                                 <command>
                                       <pathname>/tmp/testScript1.sh</pathname>
                                       <parameter>
                                            <name>file</name>
                                             <value>testScript1</value>
                                       </parameter>
                                 </command>
                      </actionlist>   
                         
                </oncheckresult>		
				
			</truststoreonly>
			
		</truststores>
		
		<crlupdatemode>CrlSelfManaged</crlupdatemode>
					
	</application>
	<user>
		<!-- keep in the same line to allow grep researches -->
		<username>myUser</username>
		<usergroup>myGroup</usergroup>
	</user>
</applications>
