<?xml version="1.0" encoding="UTF-8"?>
<applications xmlns:xsi="http://www.w3.org/2001/XMLSchema-instance"
	xsi:noNamespaceSchemaLocation="CertificateRequest.xsd">
	<application>
		<certificates>
			<certificate>
			
				<tbscertificate>
					<subject>
						<entityname>credentialmanagerCLI##hostname##</entityname>
					</subject>
					<certificateextension>
						<subjectalternativename>
							<ipaddress>1.1.1.1</ipaddress>
						</subjectalternativename>
					</certificateextension>
				</tbscertificate>
				
				<endentityprofilename>credentialmanagerCLIProfile</endentityprofilename>
				
				<keypair>
					<keypairsize>2048</keypairsize>
					<keypairalgorithm>RSA</keypairalgorithm>
				</keypair>
				
				<keystore>
					<jkskeystore>
						<storealias>admin-cert</storealias >
						<storelocation>src/test/resources/credma.jks</storelocation>
						<storepassword>password</storepassword>
					</jkskeystore>
				</keystore>

				<truststore>
					<jkstruststore>
						<storealias>credmaCA1</storealias >
						<storelocation>src/test/resources/credmaCA.jks</storelocation>
						<storepassword>password</storepassword>
					</jkstruststore>
				</truststore>								
								
				<!-- <connectormanaged>httpsConnector</connectormanaged>  -->

			</certificate>
		</certificates>
		
			<crlupdatemode>CrlSelfManaged</crlupdatemode>

	</application>
	<user>
		<!-- keep in the same line to allow grep researches -->
		<username>myUser</username>
		<usergroup>myGroup</usergroup>
	</user>
</applications>
