<?xml version="1.0" encoding="UTF-8"?>
<applications xmlns:xsi="http://www.w3.org/2001/XMLSchema-instance"
    xsi:noNamespaceSchemaLocation="CertificateRequest.xsd">
    <application>
        <certificates>
            <certificate>
                <certificatechain>true</certificatechain>
                <tbscertificate>
                    <subject>
                        <entityname>##HOSTNAME##_cpp_aa_file_signer</entityname>
                        <distinguishname>CN=##HOSTNAME##_cpp_aa_file_signer,O=Ericsson,OU=ENM,C=SE</distinguishname>
                    </subject>
                </tbscertificate>
                <endentityprofilename>ENM_System_SBI_TPFC_EP</endentityprofilename>
                <keypair>
                    <keypairsize>2048</keypairsize>
                    <keypairalgorithm>RSA</keypairalgorithm>
                </keypair>
                <keystore>
                    <pkcs12keystore>
                        <storealias>laadsigner</storealias>
                        <storelocation>/ericsson/cppaaservice/data/certs/CppAAFileSignerKeyStore.p12</storelocation>
                        <storepassword>l2K8g3xR7v</storepassword>
                    </pkcs12keystore>
                </keystore>
            </certificate>
        </certificates>
        <crlupdatemode>CrlNotManaged</crlupdatemode>
    </application>
    <user>
        <!-- keep in the same line to allow grep researches -->
        <username>root</username>
        <usergroup>root</usergroup>
    </user>
</applications>