<?xml version="1.0" encoding="UTF-8"?>
<applications xmlns:xsi="http://www.w3.org/2001/XMLSchema-instance"
	xsi:noNamespaceSchemaLocation="CertificateRequest.xsd">
	<application>

		<truststores>
		
			<truststoreonly>
				<trustprofilename>ENM_SYSTEM_TP</trustprofilename>
				<truststore>
					<jkstruststore>
						<storealias>systemTP</storealias >
						<storelocation>certs/TrustOnly.JKS</storelocation>
						<storepassword></storepassword>
					</jkstruststore>
				</truststore>	
				<crlstore>
					<base64crlstore>
						<storealias>systemTP</storealias>
						<storefolder>certs/crl_System_TP</storefolder>
						<storepassword></storepassword>
					</base64crlstore>
				</crlstore>				
			</truststoreonly>
						
			<truststoreonly>
				<trustprofilename>EPPKI_TP</trustprofilename>
				<truststore>
					<jkstruststore>
						<storealias>eppkiTP</storealias >
						<storelocation>certs/TrustOnly.JKS</storelocation>
						<storepassword></storepassword>
					</jkstruststore>
				</truststore>	
				<crlstore>
					<base64crlstore>
						<storealias>eppkiTP</storealias>
						<storefolder>certs/crl_Eeppki_TP</storefolder>
						<storepassword></storepassword>
					</base64crlstore>
				</crlstore>
				
				<oncheckresult>
                     <actionlist>
                            <checkcause>trustUpdate</checkcause>
                            <action>RunScript</action>
                                 <command>
                                       <pathname>helloworld.sh</pathname>
                                       <parameter>
                                            <name>port</name>
                                             <value>1024</value>
                                       </parameter>
                                 </command>
                      </actionlist>      
                </oncheckresult>
			</truststoreonly>
			
		</truststores>
						
		<crlupdatemode>CrlSelfManaged</crlupdatemode>
			
	</application>
	<user>
		<!-- keep in the same line to allow grep researches -->
		<username>myUser</username>
		<usergroup>myGroup</usergroup>
	</user>
</applications>
