<?xml version="1.0" encoding="UTF-8"?>
<applications xmlns:xsi="http://www.w3.org/2001/XMLSchema-instance"
 xsi:noNamespaceSchemaLocation="CertificateRequest.xsd">
    <application>
        <certificates>
            <certificate>
                <certificatechain>true</certificatechain>
                <tbscertificate>
                    <subject>
                        <entityname>##HOSTNAME##_FMCPP_OAM_Server</entityname>
                        <distinguishname>CN=##HOSTNAME##_FMCPP_OAM_Server, O=ericsson, OU=enm, C=SE</distinguishname>
                    </subject>
                </tbscertificate>
                <endentityprofilename>ENM_System_SBI_TPFC_EP</endentityprofilename>
                <keystore>
                    <pkcs12keystore>
                        <storealias>server-cert</storealias>
                        <storelocation>/ericsson/fault_management/cppalarmevent_resource_adapter/data/certs/FMCerts.p12</storelocation>
                        <storepassword>fmcorbasecurity</storepassword>
                    </pkcs12keystore>
                </keystore>
                <truststore>
                    <base64truststore>
                        <storealias>trustca</storealias>
                        <storelocation>/ericsson/fault_management/cppalarmevent_resource_adapter/data/certs/trustca_all.pem</storelocation>
                        <storepassword>fmcorbasecurity</storepassword>
                    </base64truststore>
                </truststore>
                <oncheckresult>
                    <actionlist>
                        <checkcause>certificateUpdate</checkcause>
                        <checkcause>trustUpdate</checkcause>
                        <action>VMRestart</action>
                    </actionlist>
                </oncheckresult>
            </certificate>
        </certificates>
        <crlupdatemode>CrlRequired</crlupdatemode>
    </application>
    <user>
        <username>jboss_user</username>
        <usergroup>jboss</usergroup>
    </user>
</applications>
